{
  "$schema": "https://json-schema.org/draft/2020-12/schema",
  "$id": "https://paperpilot.local/schemas/lineage-artifact-v1.schema.json",
  "title": "PaperPilot Lineage Artifact v1",
  "type": "object",
  "required": ["schema_version", "root", "nodes", "edges", "clusters", "meta"],
  "properties": {
    "schema_version": {"const": "lineage-artifact-v1"},
    "root": {"type": ["string", "null"]},
    "nodes": {
      "type": "array",
      "items": {
        "type": "object",
        "required": ["id", "is_focus"],
        "not": {"required": ["citationCount"]},
        "properties": {
          "id": {"type": "string", "pattern": "^\\S(?:[\\s\\S]*\\S)?$"},
          "is_focus": {"type": "boolean"},
          "title": {"type": "string"},
          "year": {"type": ["integer", "null"]},
          "authors": {"type": ["array", "null"], "items": {"type": "string"}},
          "citation_count": {"type": ["integer", "null"], "minimum": 0},
          "citation_count_source": {"enum": ["openalex", "semantic_scholar"]},
          "github_stars": {"type": ["integer", "null"], "minimum": 0},
          "seed_paper_id": {"type": "string", "pattern": "^[0-9a-f]{40}$"},
          "aliases": {"$ref": "#/$defs/nodeAliases"}
        },
        "allOf": [
          {
            "if": {
              "properties": {"is_focus": {"const": true}},
              "required": ["is_focus"]
            },
            "then": {"required": ["seed_paper_id"]}
          }
        ]
      }
    },
    "edges": {
      "type": "array",
      "items": {
        "type": "object",
        "required": [
          "src",
          "dst",
          "rel",
          "relation",
          "conf",
          "confidence",
          "rationale",
          "provenance"
        ],
        "properties": {
          "src": {"type": "string", "minLength": 1},
          "dst": {"type": "string", "minLength": 1},
          "rel": {"$ref": "#/$defs/relation"},
          "relation": {"$ref": "#/$defs/relation"},
          "conf": {"type": "number", "minimum": 0, "maximum": 1},
          "confidence": {"type": "number", "minimum": 0, "maximum": 1},
          "rationale": {"type": "string", "minLength": 1},
          "provenance": {"$ref": "#/$defs/provenance"}
        }
      }
    },
    "clusters": {"type": "array"},
    "meta": {
      "type": "object",
      "required": ["kind"],
      "properties": {
        "kind": {"enum": ["conference", "theme", "deep"]},
        "generator": {"type": "string", "minLength": 1, "pattern": "\\S"},
        "generated_at": {
          "type": "string",
          "format": "date-time",
          "pattern": "^\\d{4}-\\d{2}-\\d{2}T\\d{2}:\\d{2}:\\d{2}(?:\\.\\d+)?(?:Z|[+-]\\d{2}:\\d{2})$"
        }
      }
    }
  },
  "allOf": [
    {
      "if": {
        "properties": {
          "meta": {
            "properties": {"kind": {"const": "theme"}},
            "required": ["kind"]
          }
        },
        "required": ["meta"]
      },
      "then": {
        "properties": {
          "clusters": {"maxItems": 0},
          "meta": {"required": ["kind", "generator", "generated_at"]}
        }
      }
    }
  ],
  "$defs": {
    "nodeAliases": {
      "type": "array",
      "uniqueItems": true,
      "items": {
        "oneOf": [
          {
            "type": "array", "minItems": 2, "maxItems": 2,
            "prefixItems": [
              {"const": "arxiv"},
              {
                "type": "string",
                "pattern": "^(?:[0-9]{4}\\.[0-9]{4,5}|[a-z][A-Za-z0-9.-]*/[0-9]{7})$"
              }
            ]
          },
          {
            "type": "array", "minItems": 2, "maxItems": 2,
            "prefixItems": [
              {"const": "openreview"},
              {"type": "string", "pattern": "^[A-Za-z0-9_-]{1,256}$"}
            ]
          },
          {
            "type": "array", "minItems": 2, "maxItems": 2,
            "prefixItems": [
              {"enum": ["acl_anthology", "cvf"]},
              {"type": "string", "pattern": "^[A-Za-z0-9][A-Za-z0-9_.-]{0,511}$"}
            ]
          },
          {
            "type": "array", "minItems": 2, "maxItems": 2,
            "prefixItems": [
              {"const": "doi"},
              {
                "type": "string",
                "pattern": "^10\\.[0-9]{4,9}/[^A-Z\\s\\u0000-\\u001f\\u007f]+$"
              }
            ]
          },
          {
            "type": "array", "minItems": 2, "maxItems": 2,
            "prefixItems": [
              {"const": "semantic_scholar"},
              {"type": "string", "pattern": "^\\S(?:.*\\S)?$"}
            ]
          }
        ]
      }
    },
    "relation": {
      "enum": ["supersedes", "successor", "extends", "ablation", "baseline_only", "contrasts"]
    },
    "nullableNonemptyString": {
      "anyOf": [{"type": "null"}, {"type": "string", "minLength": 1}]
    },
    "provenance": {
      "type": "object",
      "additionalProperties": false,
      "required": ["producer", "evidence", "classification"],
      "properties": {
        "producer": {
          "type": "object",
          "additionalProperties": false,
          "required": ["name", "version"],
          "properties": {
            "name": {"type": "string", "minLength": 1},
            "version": {"type": "string", "minLength": 1}
          }
        },
        "evidence": {
          "type": "object",
          "additionalProperties": false,
          "required": ["source", "kind", "sha256"],
          "properties": {
            "source": {"type": "string", "minLength": 1},
            "kind": {"type": "string", "minLength": 1},
            "sha256": {"type": "string", "pattern": "^[0-9a-f]{64}$"}
          }
        },
        "classification": {
          "type": "object",
          "additionalProperties": false,
          "required": ["method", "provider", "model", "prompt_version", "schema_version"],
          "properties": {
            "method": {
              "enum": [
                "llm",
                "citation_heuristic",
                "intent_map",
                "context_pattern",
                "year_cite",
                "title_version",
                "foundational_allowlist",
                "s2_context_rule",
                "api_citation"
              ]
            },
            "provider": {"$ref": "#/$defs/nullableNonemptyString"},
            "model": {"$ref": "#/$defs/nullableNonemptyString"},
            "prompt_version": {"$ref": "#/$defs/nullableNonemptyString"},
            "schema_version": {"type": "string", "minLength": 1}
          },
          "allOf": [
            {
              "if": {"properties": {"method": {"const": "llm"}}, "required": ["method"]},
              "then": {
                "properties": {
                  "provider": {"type": "string", "minLength": 1},
                  "model": {"type": "string", "minLength": 1},
                  "prompt_version": {"type": "string", "minLength": 1}
                }
              }
            }
          ]
        }
      }
    }
  }
}
