{
  "clusters": [],
  "edges": [
    {
      "conf": 0.4,
      "confidence": 0.4,
      "dst": "openalex:W1003",
      "provenance": {
        "classification": {
          "method": "citation_heuristic",
          "model": null,
          "prompt_version": null,
          "provider": null,
          "schema_version": "relation-classification-v1"
        },
        "evidence": {
          "kind": "citation-metadata",
          "sha256": "068440983e48172d35fd045e816d85db79a56b0c286e0a12e5af4538d96bcf87",
          "source": "semantic_scholar"
        },
        "producer": {
          "name": "paperpilot.scripts.build_theme_lineage",
          "version": "p2t-v1"
        }
      },
      "rationale": "\u300cLater Extension Of Mamba\u300d(2024) \u306f\u300cMamba Sequence Modeling Paper\u300d(2023) \u3092\u5f15\u7528\u3057\u3066\u3044\u308b\uff08\u5f15\u7528\u95a2\u4fc2\u3068\u5e74\u4ee3\u306e\u307f\u304b\u3089\u306e\u63a8\u5b9a\u3067\u3001\u95a2\u4fc2\u306e\u7a2e\u985e\u306f\u672a\u5206\u985e\uff09\u3002",
      "rel": "baseline_only",
      "relation": "baseline_only",
      "src": "openalex:W1001"
    },
    {
      "conf": 0.4,
      "confidence": 0.4,
      "dst": "openalex:W1001",
      "provenance": {
        "classification": {
          "method": "citation_heuristic",
          "model": null,
          "prompt_version": null,
          "provider": null,
          "schema_version": "relation-classification-v1"
        },
        "evidence": {
          "kind": "citation-metadata",
          "sha256": "61b4465d40aa60c8fe5eac81b80003d5a4d93747562ae9ff6763c4a62ec13ddf",
          "source": "semantic_scholar"
        },
        "producer": {
          "name": "paperpilot.scripts.build_theme_lineage",
          "version": "p2t-v1"
        }
      },
      "rationale": "\u300cMamba Sequence Modeling Paper\u300d(2023) \u306f\u300cEarlier Foundational Sequence Work\u300d(2018) \u3092\u5f15\u7528\u3057\u3066\u3044\u308b\uff08\u5f15\u7528\u95a2\u4fc2\u3068\u5e74\u4ee3\u306e\u307f\u304b\u3089\u306e\u63a8\u5b9a\u3067\u3001\u95a2\u4fc2\u306e\u7a2e\u985e\u306f\u672a\u5206\u985e\uff09\u3002",
      "rel": "baseline_only",
      "relation": "baseline_only",
      "src": "openalex:W1002"
    }
  ],
  "meta": {
    "completeness": {
      "complete": true,
      "expansions_attempted": 4,
      "expansions_failed": 0,
      "supplement_failures": []
    },
    "depth": 1,
    "generated_at": "2026-06-04T00:00:00Z",
    "generator": "paperpilot.scripts.build_theme_lineage",
    "keywords": [
      "Mamba"
    ],
    "kind": "theme",
    "provenance_breakdown": {
      "citation_heuristic": 2
    },
    "seeds": [
      "openalex:W1001"
    ],
    "since_year": null,
    "slug": "mamba",
    "source": "build_theme_lineage.py",
    "theme": "Mamba"
  },
  "nodes": [
    {
      "aliases": [
        [
          "arxiv",
          "2301.00001"
        ]
      ],
      "arxiv_id": "2301.00001",
      "authors": [
        "A. Author"
      ],
      "citation_count": 500,
      "github_stars": 0,
      "id": "openalex:W1001",
      "is_focus": true,
      "kinds": [],
      "seed_paper_id": "ed0f95967f99abbc61b854824b568790dce1a90a",
      "short_abstract": "we present a research contribution in this area",
      "title": "Mamba Sequence Modeling Paper",
      "tldr": "we present a research contribution in this area",
      "venue": "NeurIPS",
      "venue_tier": "A+",
      "year": 2023
    },
    {
      "authors": [
        "A. Author"
      ],
      "citation_count": 300,
      "github_stars": 0,
      "id": "openalex:W1002",
      "is_focus": false,
      "kinds": [],
      "short_abstract": "we present a research contribution in this area",
      "title": "Earlier Foundational Sequence Work",
      "tldr": "we present a research contribution in this area",
      "venue": "NeurIPS",
      "venue_tier": "A+",
      "year": 2018
    },
    {
      "authors": [
        "A. Author"
      ],
      "citation_count": 50,
      "github_stars": 0,
      "id": "openalex:W1003",
      "is_focus": false,
      "kinds": [],
      "short_abstract": "we present a research contribution in this area",
      "title": "Later Extension Of Mamba",
      "tldr": "we present a research contribution in this area",
      "venue": "NeurIPS",
      "venue_tier": "A+",
      "year": 2024
    }
  ],
  "root": "openalex:W1001",
  "schema_version": "lineage-artifact-v1"
}
